{
  "scan_metadata": {
    "timestamp": "2026-06-17T15:42:18.119610+00:00",
    "scanner_tool": "custom-regex",
    "execution_environment": "local-dev-env"
  },
  "target_scope": {
    "stream_id": 1,
    "repository_name": "tests",
    "commit_sha": "0000000000000000000000000000000000000000"
  },
  "summary": {
    "total_findings": 24,
    "critical_count": 0,
    "high_count": 24,
    "medium_count": 0,
    "low_count": 0
  },
  "findings": [
    {
      "id": "PATTERN-0001",
      "reasoning_chain": "Static analysis identified the vulnerability; AI enrichment skipped or unavailable.",
      "severity": "HIGH",
      "stride_classification": "Tampering",
      "owasp_alignment": "LA-01",
      "affected_component": "/home/naman/Internship/GitClone/zeroclaw-scanner/tests/test_agent_client.py",
      "description": "Possible SQL injection (f-string in execute) at line 21: description='Possible SQL injection at line 3: cursor.execute(f\"SELECT...\")',",
      "remediation": {
        "steps": "Use parameterized queries or safe DOM APIs."
      }
    },
    {
      "id": "PATTERN-0002",
      "reasoning_chain": "Static analysis identified the vulnerability; AI enrichment skipped or unavailable.",
      "severity": "HIGH",
      "stride_classification": "Tampering",
      "owasp_alignment": "LA-01",
      "affected_component": "/home/naman/Internship/GitClone/zeroclaw-scanner/tests/test_agent_client.py",
      "description": "Possible SQL injection (f-string in execute) at line 22: file_path=\"database.py\",",
      "remediation": {
        "steps": "Use parameterized queries or safe DOM APIs."
      }
    },
    {
      "id": "PATTERN-0003",
      "reasoning_chain": "Static analysis identified the vulnerability; AI enrichment skipped or unavailable.",
      "severity": "HIGH",
      "stride_classification": "Tampering",
      "owasp_alignment": "LA-01",
      "affected_component": "/home/naman/Internship/GitClone/zeroclaw-scanner/tests/test_agent_client.py",
      "description": "Possible SQL injection (f-string in execute) at line 23: remediation=\"Use parameterized queries or safe DOM APIs.\",",
      "remediation": {
        "steps": "Use parameterized queries or safe DOM APIs."
      }
    },
    {
      "id": "PATTERN-0004",
      "reasoning_chain": "Static analysis identified the vulnerability; AI enrichment skipped or unavailable.",
      "severity": "HIGH",
      "stride_classification": "Tampering",
      "owasp_alignment": "LA-01",
      "affected_component": "/home/naman/Internship/GitClone/zeroclaw-scanner/tests/test_agent_client.py",
      "description": "Possible SQL injection (f-string in execute) at line 34: '    cursor.execute(f\"SELECT * FROM users WHERE id = {user_id}\")\\n'",
      "remediation": {
        "steps": "Use parameterized queries or safe DOM APIs."
      }
    },
    {
      "id": "PATTERN-0005",
      "reasoning_chain": "Static analysis identified the vulnerability; AI enrichment skipped or unavailable.",
      "severity": "HIGH",
      "stride_classification": "Tampering",
      "owasp_alignment": "LA-01",
      "affected_component": "/home/naman/Internship/GitClone/zeroclaw-scanner/tests/test_agent_client.py",
      "description": "Possible SQL injection (f-string in execute) at line 35: '    return cursor.fetchone()\\n',",
      "remediation": {
        "steps": "Use parameterized queries or safe DOM APIs."
      }
    },
    {
      "id": "PATTERN-0006",
      "reasoning_chain": "Static analysis identified the vulnerability; AI enrichment skipped or unavailable.",
      "severity": "HIGH",
      "stride_classification": "Tampering",
      "owasp_alignment": "LA-01",
      "affected_component": "/home/naman/Internship/GitClone/zeroclaw-scanner/tests/test_agent_client.py",
      "description": "Possible SQL injection (f-string in execute) at line 36: encoding=\"utf-8\",",
      "remediation": {
        "steps": "Use parameterized queries or safe DOM APIs."
      }
    },
    {
      "id": "PATTERN-0007",
      "reasoning_chain": "Static analysis identified the vulnerability; AI enrichment skipped or unavailable.",
      "severity": "HIGH",
      "stride_classification": "Tampering",
      "owasp_alignment": "LA-01",
      "affected_component": "/home/naman/Internship/GitClone/zeroclaw-scanner/tests/conftest.py",
      "description": "Possible SQL injection (f-string in execute) at line 20: cursor.execute(f\"SELECT * FROM users WHERE id = {user_id}\")",
      "remediation": {
        "steps": "Use parameterized queries or safe DOM APIs."
      }
    },
    {
      "id": "PATTERN-0008",
      "reasoning_chain": "Static analysis identified the vulnerability; AI enrichment skipped or unavailable.",
      "severity": "HIGH",
      "stride_classification": "Tampering",
      "owasp_alignment": "LA-01",
      "affected_component": "/home/naman/Internship/GitClone/zeroclaw-scanner/tests/conftest.py",
      "description": "Possible SQL injection (f-string in execute) at line 21: return cursor.fetchone()",
      "remediation": {
        "steps": "Use parameterized queries or safe DOM APIs."
      }
    },
    {
      "id": "PATTERN-0009",
      "reasoning_chain": "Static analysis identified the vulnerability; AI enrichment skipped or unavailable.",
      "severity": "HIGH",
      "stride_classification": "Tampering",
      "owasp_alignment": "LA-01",
      "affected_component": "/home/naman/Internship/GitClone/zeroclaw-scanner/tests/conftest.py",
      "description": "Possible SQL injection (f-string in execute) at line 22: ",
      "remediation": {
        "steps": "Use parameterized queries or safe DOM APIs."
      }
    },
    {
      "id": "PATTERN-0010",
      "reasoning_chain": "Static analysis identified the vulnerability; AI enrichment skipped or unavailable.",
      "severity": "HIGH",
      "stride_classification": "Tampering",
      "owasp_alignment": "LA-01",
      "affected_component": "/home/naman/Internship/GitClone/zeroclaw-scanner/tests/conftest.py",
      "description": "XSS risk: innerHTML assignment at line 32: document.getElementById(\"name\").innerHTML = user.name;",
      "remediation": {
        "steps": "Use parameterized queries or safe DOM APIs."
      }
    },
    {
      "id": "PATTERN-0011",
      "reasoning_chain": "Static analysis identified the vulnerability; AI enrichment skipped or unavailable.",
      "severity": "HIGH",
      "stride_classification": "Tampering",
      "owasp_alignment": "LA-01",
      "affected_component": "/home/naman/Internship/GitClone/zeroclaw-scanner/tests/conftest.py",
      "description": "XSS risk: innerHTML assignment at line 33: document.getElementById(\"safe\").textContent = user.name;",
      "remediation": {
        "steps": "Use parameterized queries or safe DOM APIs."
      }
    },
    {
      "id": "PATTERN-0012",
      "reasoning_chain": "Static analysis identified the vulnerability; AI enrichment skipped or unavailable.",
      "severity": "HIGH",
      "stride_classification": "Tampering",
      "owasp_alignment": "LA-01",
      "affected_component": "/home/naman/Internship/GitClone/zeroclaw-scanner/tests/conftest.py",
      "description": "XSS risk: innerHTML assignment at line 34: }",
      "remediation": {
        "steps": "Use parameterized queries or safe DOM APIs."
      }
    },
    {
      "id": "SEC-KEY-001",
      "reasoning_chain": "Static analysis identified the vulnerability; AI enrichment skipped or unavailable.",
      "severity": "HIGH",
      "stride_classification": "Information Disclosure",
      "owasp_alignment": "LA-01",
      "affected_component": "test_secret_scanner.py",
      "description": "A hardcoded api key was detected in the source code.",
      "remediation": {
        "steps": "Remove the hardcoded secret and replace it with environment variable injection or a secret vault lookup."
      }
    },
    {
      "id": "SEC-KEY-002",
      "reasoning_chain": "Static analysis identified the vulnerability; AI enrichment skipped or unavailable.",
      "severity": "HIGH",
      "stride_classification": "Information Disclosure",
      "owasp_alignment": "LA-01",
      "affected_component": "test_secret_scanner.py",
      "description": "A hardcoded password/secret was detected in the source code.",
      "remediation": {
        "steps": "Remove the hardcoded secret and replace it with environment variable injection or a secret vault lookup."
      }
    },
    {
      "id": "SEC-KEY-003",
      "reasoning_chain": "Static analysis identified the vulnerability; AI enrichment skipped or unavailable.",
      "severity": "HIGH",
      "stride_classification": "Information Disclosure",
      "owasp_alignment": "LA-01",
      "affected_component": "test_secret_scanner.py",
      "description": "A hardcoded password/secret was detected in the source code.",
      "remediation": {
        "steps": "Remove the hardcoded secret and replace it with environment variable injection or a secret vault lookup."
      }
    },
    {
      "id": "SEC-KEY-004",
      "reasoning_chain": "Static analysis identified the vulnerability; AI enrichment skipped or unavailable.",
      "severity": "HIGH",
      "stride_classification": "Information Disclosure",
      "owasp_alignment": "LA-01",
      "affected_component": "test_secret_scanner.py",
      "description": "A hardcoded anthropic api key was detected in the source code.",
      "remediation": {
        "steps": "Remove the hardcoded secret and replace it with environment variable injection or a secret vault lookup."
      }
    },
    {
      "id": "SEC-KEY-005",
      "reasoning_chain": "Static analysis identified the vulnerability; AI enrichment skipped or unavailable.",
      "severity": "HIGH",
      "stride_classification": "Information Disclosure",
      "owasp_alignment": "LA-01",
      "affected_component": "conftest.py",
      "description": "A hardcoded api key was detected in the source code.",
      "remediation": {